{
 "schema_version": "motionbook.catalog.v2",
 "source": "https://github.com/younatics/MotionBook",
 "stats_as_of": "2026-10-24",
 "gif_base_url": "https://raw.githubusercontent.com/younatics/MotionBook/master/",
 "app": {
  "name": "MotionBook",
  "app_store_id": "1205163580",
  "version": "3.6",
  "live_demos": [
   "ActivityIndicatorView",
   "AnimateText",
   "AnimatedCollectionViewLayout",
   "CRToast",
   "ConfettiSwiftUI",
   "FLAnimatedImage",
   "FluidGradient",
   "Glur",
   "Grid (exyte)",
   "Hero",
   "Highlighter",
   "IBAnimatable",
   "Inferno",
   "JTMaterialTransition",
   "Koloda",
   "LTMorphingLabel",
   "Liquid",
   "Lottie",
   "MIBlurPopup",
   "Macaw",
   "MarkdownView",
   "MediaBrowser",
   "Motion (b3ll)",
   "NVActivityIndicatorView",
   "NotificationBanner",
   "PKHUD",
   "Pastel",
   "Popovers",
   "PopupDialog",
   "PopupView",
   "Pow",
   "Pull-to-Refresh.Rentals-iOS",
   "RQShineLabel",
   "RevealingSplashView",
   "SDCAlertView",
   "ScalingHeaderScrollView",
   "Segmentio",
   "Shiny",
   "SideMenu",
   "SkeletonView",
   "Spring",
   "SweetAlert-iOS",
   "SwiftUI-Shimmer",
   "SwipeCellKit",
   "TKRubberIndicator",
   "Transmission",
   "ViewAnimator",
   "Vortex",
   "Wave",
   "XLPagerTabStrip",
   "YNDropDownMenu",
   "YNExpandableCell",
   "YNSearch",
   "animated-tab-bar",
   "circle-menu",
   "expanding-collection",
   "folding-cell",
   "preview-transition",
   "rive-ios"
  ]
 },
 "libraries": [
  {
   "title": "Lottie",
   "author": "Airbnb",
   "category": "Animation",
   "summary": "Render After Effects animations natively and keep product motion consistent across screens.",
   "url": "https://github.com/airbnb/lottie-ios",
   "tags": [
    "vector",
    "after effects",
    "json"
   ],
   "featured": true,
   "gif": null,
   "stars": 26918,
   "pushed": "2026-10-06",
   "license": "Apache-2.0",
   "archived": false,
   "latest_tag": "4.6.1",
   "install": {
    "spm": true,
    "spm_package": ".package(url: \"https://github.com/airbnb/lottie-ios\", from: \"4.6.1\")",
    "cocoapods": false,
    "carthage": false
   },
   "live_demo": true,
   "verified": {
    "date": "2026-10-25",
    "xcode": "27.1",
    "ios": "27.1",
    "via": "MotionBook app 3.6 live demo (built, run and screenshot-reviewed)"
   }
  },
  {
   "title": "Hero",
   "author": "lkzhao",
   "category": "Transition",
   "summary": "Hero is a library for building iOS view controller transitions. It provides a layer on top of the UIKit's cumbersome transition APIs. Making custom transitions an easy task for developers.",
   "url": "https://github.com/HeroTransitions/Hero",
   "tags": [
    "transition",
    "navigation",
    "interactive"
   ],
   "featured": true,
   "gif": "motion-book/Hero.gif",
   "stars": 22487,
   "pushed": "2025-01-23",
   "license": "MIT",
   "archived": false,
   "latest_tag": "1.6.4",
   "install": {
    "spm": true,
    "spm_package": ".package(url: \"https://github.com/HeroTransitions/Hero\", from: \"1.6.4\")",
    "cocoapods": true,
    "carthage": true
   },
   "live_demo": true,
   "verified": {
    "date": "2026-10-25",
    "xcode": "27.1",
    "ios": "27.1",
    "via": "MotionBook app 3.6 live demo (built, run and screenshot-reviewed)"
   }
  },
  {
   "title": "Pop",
   "author": "Facebook",
   "category": "Animation",
   "summary": "Classic extensible animation primitives for spring and decay motion in UIKit apps.",
   "url": "https://github.com/facebookarchive/pop",
   "tags": [
    "spring",
    "decay",
    "classic"
   ],
   "featured": false,
   "gif": null,
   "stars": 19513,
   "pushed": "2020-01-02",
   "license": null,
   "archived": true,
   "latest_tag": "1.0.11",
   "install": {
    "spm": false,
    "spm_package": null,
    "cocoapods": true,
    "carthage": false
   },
   "live_demo": false,
   "verified": null
  },
  {
   "title": "Spring",
   "author": "MengTo",
   "category": "Animation",
   "summary": "A library to simplify iOS animations in Swift.",
   "url": "https://github.com/MengTo/Spring",
   "tags": [
    "prototype",
    "easing",
    "spring"
   ],
   "featured": false,
   "gif": "motion-book/Spring.gif",
   "stars": 14064,
   "pushed": "2023-07-03",
   "license": "MIT",
   "archived": false,
   "latest_tag": "1.0.5",
   "install": {
    "spm": false,
    "spm_package": null,
    "cocoapods": true,
    "carthage": false
   },
   "live_demo": true,
   "verified": {
    "date": "2026-10-25",
    "xcode": "27.1",
    "ios": "27.1",
    "via": "MotionBook app 3.6 live demo (built, run and screenshot-reviewed)"
   }
  },
  {
   "title": "SkeletonView",
   "author": "Juanpe",
   "category": "Animation",
   "summary": "Today almost all apps have async processes, such as Api requests, long running processes, etc. And while the processes are working, usually developers place a loading view to show users that something is going on.SkeletonView has been conceived to address this need, an elegant way to show users that something is happening and also prepare them to which contents he is waiting.",
   "url": "https://github.com/Juanpe/SkeletonView",
   "tags": [],
   "featured": false,
   "gif": "motion-book/SkeletonView.gif",
   "stars": 12889,
   "pushed": "2026-06-23",
   "license": "MIT",
   "archived": false,
   "latest_tag": "1.31.0",
   "install": {
    "spm": true,
    "spm_package": ".package(url: \"https://github.com/Juanpe/SkeletonView\", from: \"1.31.0\")",
    "cocoapods": true,
    "carthage": true
   },
   "live_demo": true,
   "verified": {
    "date": "2026-10-25",
    "xcode": "27.1",
    "ios": "27.1",
    "via": "MotionBook app 3.6 live demo (built, run and screenshot-reviewed)"
   }
  },
  {
   "title": "animated-tab-bar",
   "author": "Ramotion",
   "category": "Menu",
   "summary": "RAMAnimatedTabBarController is a Swift module for adding animation to tabbar items.",
   "url": "https://github.com/Ramotion/animated-tab-bar",
   "tags": [],
   "featured": false,
   "gif": "motion-book/animated-tab-bar.gif",
   "stars": 11083,
   "pushed": "2022-01-26",
   "license": "MIT",
   "archived": false,
   "latest_tag": "5.1.0",
   "install": {
    "spm": true,
    "spm_package": ".package(url: \"https://github.com/Ramotion/animated-tab-bar\", from: \"5.1.0\")",
    "cocoapods": true,
    "carthage": true
   },
   "live_demo": true,
   "verified": {
    "date": "2026-10-25",
    "xcode": "27.1",
    "ios": "27.1",
    "via": "MotionBook app 3.6 live demo (built, run and screenshot-reviewed)"
   }
  },
  {
   "title": "NVActivityIndicatorView",
   "author": "ninjaprox",
   "category": "Indicator",
   "summary": "NVActivityIndicatorView is a collection of awesome loading animations.",
   "url": "https://github.com/ninjaprox/NVActivityIndicatorView",
   "tags": [
    "loading",
    "indicator",
    "feedback"
   ],
   "featured": false,
   "gif": "motion-book/NVActivityIndicatorView.gif",
   "stars": 10700,
   "pushed": "2026-03-18",
   "license": "MIT",
   "archived": false,
   "latest_tag": "5.2.0",
   "install": {
    "spm": true,
    "spm_package": ".package(url: \"https://github.com/ninjaprox/NVActivityIndicatorView\", from: \"5.2.0\")",
    "cocoapods": true,
    "carthage": true
   },
   "live_demo": true,
   "verified": {
    "date": "2026-10-25",
    "xcode": "27.1",
    "ios": "27.1",
    "via": "MotionBook app 3.6 live demo (built, run and screenshot-reviewed)"
   }
  },
  {
   "title": "folding-cell",
   "author": "Ramotion",
   "category": "Table View",
   "summary": "FoldingCell is an expanding content cell inspired by folding paper material",
   "url": "https://github.com/Ramotion/folding-cell",
   "tags": [
    "table",
    "card",
    "interaction"
   ],
   "featured": false,
   "gif": "motion-book/folding-cell.gif",
   "stars": 10169,
   "pushed": "2024-04-28",
   "license": "MIT",
   "archived": false,
   "latest_tag": "5.0.2",
   "install": {
    "spm": true,
    "spm_package": ".package(url: \"https://github.com/Ramotion/folding-cell\", from: \"5.0.2\")",
    "cocoapods": true,
    "carthage": true
   },
   "live_demo": true,
   "verified": {
    "date": "2026-10-25",
    "xcode": "27.1",
    "ios": "27.1",
    "via": "MotionBook app 3.6 live demo (built, run and screenshot-reviewed)"
   }
  },
  {
   "title": "IBAnimatable",
   "author": "IBAnimatable",
   "category": "UI",
   "summary": "Design and prototype customized UI, interaction, navigation, transition and animation for App Store ready Apps in Interface Builder with IBAnimatable.",
   "url": "https://github.com/IBAnimatable/IBAnimatable",
   "tags": [
    "interface builder",
    "prototype",
    "design"
   ],
   "featured": false,
   "gif": "motion-book/IBAnimatable.gif",
   "stars": 8634,
   "pushed": "2023-02-21",
   "license": "MIT",
   "archived": false,
   "latest_tag": "6.1.0",
   "install": {
    "spm": true,
    "spm_package": ".package(url: \"https://github.com/IBAnimatable/IBAnimatable\", from: \"6.1.0\")",
    "cocoapods": true,
    "carthage": true
   },
   "live_demo": true,
   "verified": {
    "date": "2026-10-25",
    "xcode": "27.1",
    "ios": "27.1",
    "via": "MotionBook app 3.6 live demo (built, run and screenshot-reviewed)"
   }
  },
  {
   "title": "LTMorphingLabel",
   "author": "lexrus",
   "category": "UI",
   "summary": "A morphing UILabel subclass written in Swift. The .Scale effect mimicked Apple's QuickType animation of iOS 8 in WWDC 2014. New morphing effects are available as Swift extensions.",
   "url": "https://github.com/lexrus/LTMorphingLabel",
   "tags": [
    "text",
    "label",
    "morph"
   ],
   "featured": false,
   "gif": "motion-book/LTMorphingLabel.gif",
   "stars": 8135,
   "pushed": "2026-03-08",
   "license": "MIT",
   "archived": false,
   "latest_tag": "0.9.3",
   "install": {
    "spm": true,
    "spm_package": ".package(url: \"https://github.com/lexrus/LTMorphingLabel\", from: \"0.9.3\")",
    "cocoapods": true,
    "carthage": true
   },
   "live_demo": true,
   "verified": {
    "date": "2026-10-25",